{
  "schema_version": "1.0",
  "registry_id": "ku-bo-five-security-pilot-benchmarks-v1",
  "registry_observed_on": "2026-08-10",
  "registry_date_basis": "KU_BO_REGISTRY_OBSERVATION_NOT_PROVIDER_LAUNCH_OR_SERIES_INCEPTION",
  "claim_boundary": "INTERNAL_REQUIREMENT_CODES_ONLY_PROVIDER_CODES_AND_SERIES_INCEPTION_UNVERIFIED",
  "benchmarks": [
    {
      "benchmark_code": "KU_BO_BROAD_MARKET_PRICE",
      "benchmark_code_namespace": "KU_BO_INTERNAL",
      "benchmark_name": "Pilot Broad Market Price Benchmark Requirement",
      "provider": "UNCONFIGURED_AUTHORIZED_BENCHMARK_PROVIDER",
      "source_id": "authorized_market_feed_unconfigured",
      "source_url": "https://data.boursakuwait.com.kw/",
      "currency": "KWD",
      "unit": "INDEX_POINTS",
      "market_scope": "BROAD_MARKET",
      "sector": "",
      "calculation_basis": "PRICE_INDEX",
      "frequency": "DAILY_CLOSE",
      "effective_from": "2026-08-10",
      "effective_to": null,
      "source_access": "LICENSED_EXPORT",
      "rights_requirement": "EXTERNAL_LICENSE_REQUIRED",
      "registry_state": "UNVERIFIED_SEED",
      "required_for_pilot": true
    },
    {
      "benchmark_code": "KU_BO_BANKS_SECTOR_PRICE",
      "benchmark_code_namespace": "KU_BO_INTERNAL",
      "benchmark_name": "Pilot Banks Sector Price Benchmark Requirement",
      "provider": "UNCONFIGURED_AUTHORIZED_BENCHMARK_PROVIDER",
      "source_id": "authorized_market_feed_unconfigured",
      "source_url": "https://data.boursakuwait.com.kw/",
      "currency": "KWD",
      "unit": "INDEX_POINTS",
      "market_scope": "SECTOR",
      "sector": "Banks",
      "calculation_basis": "PRICE_INDEX",
      "frequency": "DAILY_CLOSE",
      "effective_from": "2026-08-10",
      "effective_to": null,
      "source_access": "LICENSED_EXPORT",
      "rights_requirement": "EXTERNAL_LICENSE_REQUIRED",
      "registry_state": "UNVERIFIED_SEED",
      "required_for_pilot": true
    },
    {
      "benchmark_code": "KU_BO_REAL_ESTATE_SECTOR_PRICE",
      "benchmark_code_namespace": "KU_BO_INTERNAL",
      "benchmark_name": "Pilot Real Estate Sector Price Benchmark Requirement",
      "provider": "UNCONFIGURED_AUTHORIZED_BENCHMARK_PROVIDER",
      "source_id": "authorized_market_feed_unconfigured",
      "source_url": "https://data.boursakuwait.com.kw/",
      "currency": "KWD",
      "unit": "INDEX_POINTS",
      "market_scope": "SECTOR",
      "sector": "Real Estate",
      "calculation_basis": "PRICE_INDEX",
      "frequency": "DAILY_CLOSE",
      "effective_from": "2026-08-10",
      "effective_to": null,
      "source_access": "LICENSED_EXPORT",
      "rights_requirement": "EXTERNAL_LICENSE_REQUIRED",
      "registry_state": "UNVERIFIED_SEED",
      "required_for_pilot": true
    },
    {
      "benchmark_code": "KU_BO_TELECOMMUNICATIONS_SECTOR_PRICE",
      "benchmark_code_namespace": "KU_BO_INTERNAL",
      "benchmark_name": "Pilot Telecommunications Sector Price Benchmark Requirement",
      "provider": "UNCONFIGURED_AUTHORIZED_BENCHMARK_PROVIDER",
      "source_id": "authorized_market_feed_unconfigured",
      "source_url": "https://data.boursakuwait.com.kw/",
      "currency": "KWD",
      "unit": "INDEX_POINTS",
      "market_scope": "SECTOR",
      "sector": "Telecommunications",
      "calculation_basis": "PRICE_INDEX",
      "frequency": "DAILY_CLOSE",
      "effective_from": "2026-08-10",
      "effective_to": null,
      "source_access": "LICENSED_EXPORT",
      "rights_requirement": "EXTERNAL_LICENSE_REQUIRED",
      "registry_state": "UNVERIFIED_SEED",
      "required_for_pilot": true
    },
    {
      "benchmark_code": "KU_BO_CONSUMER_SERVICES_SECTOR_PRICE",
      "benchmark_code_namespace": "KU_BO_INTERNAL",
      "benchmark_name": "Pilot Consumer Services Sector Price Benchmark Requirement",
      "provider": "UNCONFIGURED_AUTHORIZED_BENCHMARK_PROVIDER",
      "source_id": "authorized_market_feed_unconfigured",
      "source_url": "https://data.boursakuwait.com.kw/",
      "currency": "KWD",
      "unit": "INDEX_POINTS",
      "market_scope": "SECTOR",
      "sector": "Consumer Services",
      "calculation_basis": "PRICE_INDEX",
      "frequency": "DAILY_CLOSE",
      "effective_from": "2026-08-10",
      "effective_to": null,
      "source_access": "LICENSED_EXPORT",
      "rights_requirement": "EXTERNAL_LICENSE_REQUIRED",
      "registry_state": "UNVERIFIED_SEED",
      "required_for_pilot": true
    },
    {
      "benchmark_code": "KU_BO_BROAD_MARKET_TOTAL_RETURN",
      "benchmark_code_namespace": "KU_BO_INTERNAL",
      "benchmark_name": "Pilot Broad Market Total Return Benchmark Requirement",
      "provider": "UNCONFIGURED_AUTHORIZED_BENCHMARK_PROVIDER",
      "source_id": "authorized_market_feed_unconfigured",
      "source_url": "https://data.boursakuwait.com.kw/",
      "currency": "KWD",
      "unit": "INDEX_POINTS",
      "market_scope": "BROAD_MARKET",
      "sector": "",
      "calculation_basis": "TOTAL_RETURN_INDEX",
      "frequency": "DAILY_CLOSE",
      "effective_from": "2026-08-10",
      "effective_to": null,
      "source_access": "LICENSED_EXPORT",
      "rights_requirement": "EXTERNAL_LICENSE_REQUIRED",
      "registry_state": "UNVERIFIED_SEED",
      "required_for_pilot": true
    },
    {
      "benchmark_code": "KU_BO_BANKS_SECTOR_TOTAL_RETURN",
      "benchmark_code_namespace": "KU_BO_INTERNAL",
      "benchmark_name": "Pilot Banks Sector Total Return Benchmark Requirement",
      "provider": "UNCONFIGURED_AUTHORIZED_BENCHMARK_PROVIDER",
      "source_id": "authorized_market_feed_unconfigured",
      "source_url": "https://data.boursakuwait.com.kw/",
      "currency": "KWD",
      "unit": "INDEX_POINTS",
      "market_scope": "SECTOR",
      "sector": "Banks",
      "calculation_basis": "TOTAL_RETURN_INDEX",
      "frequency": "DAILY_CLOSE",
      "effective_from": "2026-08-10",
      "effective_to": null,
      "source_access": "LICENSED_EXPORT",
      "rights_requirement": "EXTERNAL_LICENSE_REQUIRED",
      "registry_state": "UNVERIFIED_SEED",
      "required_for_pilot": true
    },
    {
      "benchmark_code": "KU_BO_REAL_ESTATE_SECTOR_TOTAL_RETURN",
      "benchmark_code_namespace": "KU_BO_INTERNAL",
      "benchmark_name": "Pilot Real Estate Sector Total Return Benchmark Requirement",
      "provider": "UNCONFIGURED_AUTHORIZED_BENCHMARK_PROVIDER",
      "source_id": "authorized_market_feed_unconfigured",
      "source_url": "https://data.boursakuwait.com.kw/",
      "currency": "KWD",
      "unit": "INDEX_POINTS",
      "market_scope": "SECTOR",
      "sector": "Real Estate",
      "calculation_basis": "TOTAL_RETURN_INDEX",
      "frequency": "DAILY_CLOSE",
      "effective_from": "2026-08-10",
      "effective_to": null,
      "source_access": "LICENSED_EXPORT",
      "rights_requirement": "EXTERNAL_LICENSE_REQUIRED",
      "registry_state": "UNVERIFIED_SEED",
      "required_for_pilot": true
    },
    {
      "benchmark_code": "KU_BO_TELECOMMUNICATIONS_SECTOR_TOTAL_RETURN",
      "benchmark_code_namespace": "KU_BO_INTERNAL",
      "benchmark_name": "Pilot Telecommunications Sector Total Return Benchmark Requirement",
      "provider": "UNCONFIGURED_AUTHORIZED_BENCHMARK_PROVIDER",
      "source_id": "authorized_market_feed_unconfigured",
      "source_url": "https://data.boursakuwait.com.kw/",
      "currency": "KWD",
      "unit": "INDEX_POINTS",
      "market_scope": "SECTOR",
      "sector": "Telecommunications",
      "calculation_basis": "TOTAL_RETURN_INDEX",
      "frequency": "DAILY_CLOSE",
      "effective_from": "2026-08-10",
      "effective_to": null,
      "source_access": "LICENSED_EXPORT",
      "rights_requirement": "EXTERNAL_LICENSE_REQUIRED",
      "registry_state": "UNVERIFIED_SEED",
      "required_for_pilot": true
    },
    {
      "benchmark_code": "KU_BO_CONSUMER_SERVICES_SECTOR_TOTAL_RETURN",
      "benchmark_code_namespace": "KU_BO_INTERNAL",
      "benchmark_name": "Pilot Consumer Services Sector Total Return Benchmark Requirement",
      "provider": "UNCONFIGURED_AUTHORIZED_BENCHMARK_PROVIDER",
      "source_id": "authorized_market_feed_unconfigured",
      "source_url": "https://data.boursakuwait.com.kw/",
      "currency": "KWD",
      "unit": "INDEX_POINTS",
      "market_scope": "SECTOR",
      "sector": "Consumer Services",
      "calculation_basis": "TOTAL_RETURN_INDEX",
      "frequency": "DAILY_CLOSE",
      "effective_from": "2026-08-10",
      "effective_to": null,
      "source_access": "LICENSED_EXPORT",
      "rights_requirement": "EXTERNAL_LICENSE_REQUIRED",
      "registry_state": "UNVERIFIED_SEED",
      "required_for_pilot": true
    }
  ]
}
